tipos,descripcion
ISTJ,"menudo culpar irrazonablemente mismo : combinarse hacer especialista logístico creer único poder ver proyecto manera confiable . medir cargar trabajar responsabilidad adicional , rechazar bueno intención ideo útil , especialista logístico tardar temprano llegar inflexión simplemente poder cumplir . dar acumular responsabilidad mismo , especialista logístico creer responsabilidad fracasar ellos ."
ISFP,"apasionar : debajo tranquilo timidez latir corazón intensamente . personar atrapar emocionante interesante , poder dejar demás polvo ."
ESFP,"artista nato , encantar mirar , mundo escenario . mucho personar famoso actor , gustar hacer espectáculo amigo , charlar ingeniar único mundano , absorber atención hacer parecer fiesta . sociable , disfrutar coser simple mayor alegría simplemente divertirse bueno grupo amigo ."
INFJ,vivir luchar día
ISFJ,si poder protegerte hacer
ENFP,"independiente fallo : detestar administrar formar microadministrada restringir reglar duro , querer ser ver maestro altamente independiente propio destino , incluso poseedor sabiduría altruista ir allá ley draconiano . desafiar vivir mundo controlar equilibrio , píldora feliz tragar ."
ESFP,"práctico : artista , mundo deber sentirse experimentarse . verdad extraño ficción , artista preferir ver hacer ponerse filosófico "" qué pasar si "" ."
ENTP,"carismático : personar formar palabra ingeniar encontrar intrigante . confianza , pensamiento rápido capacidad conectar ideo disparar formar novedoso creer estilar comunicación encantador , incluso entretener informativo mismo tiempo ."
ISFP,significar cada expresión vida
INFJ,"inspirador convincente : hablar término humano , técnico , estilar escriturar fluir inspirador atraer idealista internar audiencia . poder incluso ser orador asombrosamente bueno , hablar calidez pasión . especialmente cierto si orgulloso hablar ."
INFJ,ayúdame ayudarte
ESTP,"tal vez visión perspicaz filtrar cualquiera tipo , habilidad único percibir pequeño cambio . cambiar expresión facial , nuevo estilar ropa hábito rotar , personar poder darse contar pensamiento motivo oculto , mientras mayoría restar afortunado si poder darse contar algo . utilizar observación inmediato , anunciar cambiar hacer preguntar , mucho vez poco sensibilidad . deber recordar mundo querer publicar secreto decisión ."
ENTP,"capacidad debatir innovador resultar irritante y , aunque mucho vez apreciar necesitar , quedar penosamente interferir u ofender palabra , ejemplo cuestionar abiertamente jefe reunión echar tierra importante decir . complicar aun honestidad inquebrantable innovador , andar rodeo preocupar tratar ser sensible compasivo . individuo similar llevar bastante bien innovador , sensible sociedad general soler ser reacio conflicto preferir sentimiento , comodidad incluso mentira piadoso verdad hiriente duro racionalidad ."
INFP,"creativo : mediador combinar naturaleza visionario mentalidad abrir permitirles ver coser perspectivo convencional . poder conectar punto remoto temer , extrañar mediador poeta autor famoso ."
ENFJ,"gente soler atraer fuerte protagonista irradiar autenticidad , preocupación altruismo , miedo levantarse hablar creer decir . resultar natural fácil comunicarse demás , personalmente , intuición natural ayudar personar llegar todo mente , través hecho fuerte emocionar . protagonista ver fácilmente motivación personar acontecimiento aparentemente inconexo , capaz fusionar ideo comunicarlas objetivar común elocuencia simplemente fascinante ."
ISFP,"“ cambiar cursar día . despertar personar , ir dormir ser certeza personar . ” individuo verdadero artista , necesariamente típico , referir pintar cuadro . embargar , frecuencia , capaz ese . bien utilizar estético , diseñar incluso elección accionar sacar máximo partir convención social . disfrutar alterar expectativa tradicional experimento belleza comportamiento ; probable ocasión decir frase : “ ¡ no encasillar ! ” feliz ser"
ISFJ,"entusiasta : objetivar correcto , tomar apoyar , confiabilidad imaginación aplicar creer marcar diferenciar vida personar , luchar pobreza iniciativo global simplemente alegrar día cliente ."
INFJ,"determinar apasionar : llegar creer importante , perseguir objetivar convicción energía poder pillar desprevenido otro . sacudir botar si deber hacerlo . gustar ver este , pasión causar elegir partir inseparable advocate ."
ISTP,"saber cómo priorizar : flexibilidad venir cierto imprevisibilidad , poder almacenar espontaneidad día lluvioso , liberar energía justar necesitar ."
ESFP,"observador : enfocar aquí ahora , hacer actuar , artista natural hora notar coser cambio real tangible ."
ISFJ,"naturalmente sociable , cualidad extraño personar introvertido , utilizar excelente memoria retener dato trivialidad sino recordar personar detalle vida . tratar ofrecer alguno regalar , inigualable utilizar imaginación sensibilidad natural expresar generosidad formar afectar corazón destinatario . aunque realmente mostrar compañero trabajar , personar menudo considerar amigo personal , familia expresión afectar realmente salir luz ."
INTP,"contrario ser cierto personar explicar proceso pensamiento término subjetividad sentimiento . imaginar mecanismo relojería complejo , coger cada posible hacer ideo , procesar fuerte dosis razonamiento creativo devolver resultar sensato lógicamente hablar ; asir funcionar mente lógico , tolerante llave inglés bloquear máquina ."
ISFP,"demasiar competitivo : poder escalar coser pequeño competencia intenso , rechazar éxito largar plazo búsqueda gloria momento , infeliz perder ."
ESTJ,"principal desafiar reconocer mundo seguir mismo caminar contribuir mismo manera . verdadero líder reconocer forzar individuo , asir grupo , ayudar personar aportar ideo . manera , todo información capaz liderar grupo direccionar útil todo . dedicar : ver coser finalización limitar obligación ético ejecutivo . tarea abandonar simplemente volver difícil aburrir : personar ejecutivo aceptar correcto , terminar siempre seguir ser correcto ."
ENFP,"altamente emocional : si bien expresión emocional saludable natural , incluso ver partir central identidad , ser suficientemente fuerte causar problema personalidad . particularmente bajar estrés , crítico conflicto , poder experimentar explosionar emocional contraproducente mejor caso ."
INFP,"escuchar mucho gente , hablar"
INTJ,"brillante confiar conocimiento llevar tiempo entender , lamentablemente probable acordar social materia . mentira piadoso conversación superficial suficientemente duro anhelar verdad profundidad , poder llegar considerar mucho convención social francamente estúpido . irónicamente , menudo mejor permanecer cómodo , alejar centrar atención , confianza natural predominar trabajar materia resultar familiar servir propio faro atraer gente , romántico no , temperamento interesar similar ."
ISTP,"fácilmente aburrir : disfrutar novedad , hacer excelente manipulador , menos confiable tratar enfocarse coser largar plazo . vez entender algo , tender simplemente pasar nuevo interesante ."
ESTJ,"embargar , trabajar solo esperar fiabilidad ético trabajar recíproco ; personar cumplir promesa si compañero subordinar poner peligrar incompetencia pereza , peor aun , falto honradez , tardar mostrar enfadar . hacer tener reputación personar inflexible , caprichosamente terco sino realmente creer valorar hacer sociedad funcionar ."
INFP,"“ no orar relucir ; vagar perdido ; viejo , si vigoroso , marchito ; raíz profundo afecto helar . ” saber ser , saber poder ser"
ENFP,"observador : creer accionar irrelevante , cada cambiar sentimiento , cada movimiento cada ideo partir grande . satisfacer curiosidad , intentar notar todo coser nunca perder momento ."
ESFJ,"fuerte deber : personar fuerte responsabilidad esforzar cumplir obligación , aunque vez ser expectativa social impulsar intrínseco ."
ESFJ,"servicial extrovertido , fácil descubrir fiesta ; ¡ ser dedicar tiempo charlar reír mundo ! devoción ir allá simplemente allí hacerlo . verdaderamente disfrutar escuchar amigo hablar relacionar actividad , recordar pequeño detalle siempre disponer hablar coser calidez sensibilidad . si coser ir bien tensión salar , percibir tratar restablecer armonía estabilidad grupo ."
ESTJ,"demasiar centrar estatus social : enorgullecer respetar amigo , colega comunidad y , aunque difícil admitir , preocupar opinión público . ( especialmente turbulento ) poder quedar tan atrapar cumplimiento expectativa demás satisfacer propio necesidad ."
ESFJ,"leal : valorar altamente estabilidad seguridad , ansioso preservar status quo , convertir socio emplear extremadamente leal confiable . verdadero pilar cualquiera grupo pertenecer , familia club comunitario , siempre confiar personar personalidad ."
ENFJ,"demasiar desinteresar : protagonista poder enterrarse promesa esperanzador , problema demás propio esforzándose cumplir palabra . si cuidar , poder extenderse demasiar poder ayudar nadie ."
ENTP,"pensador rápido : debatir mente tremendamente flexible poder cambiar ideo esforzar , aprovechar conocimiento acumular probar punto oponente , según considerar conveniente ."
ENTJ,"si desear retar , grande pequeño , creer firmemente tiempo recurso suficiente poder conseguir cualquiera meter . cualidad hacer personar comandante convertir empresario brillante , capacidad pensar estratégicamente mantener enfocar largar plazo ejecución cada pasar plan determinación precisión , convertir líder empresario importante . determinación menudo profecía autorrealizada , intentar conseguir objetivo puro forzar voluntad mientras poder darse vencer dedicarse coser , habilidad social hacer restar gente seguir fielmente lograr resultar espectacular procesar . mesar negociación , entornar corporativo comprar coche , dominante implacable . deber personar frío despiadado sí , sino individuo comandante realmente disfrutar desafío , batallar ingeniar , interesante conversación surgir entornar y , si partir continuar , motivar cesar empeñar conseguir objetivar fundamental : victoria final ."
INTJ,"cuestión principio , ponte firmar roca"
ISFJ,"prácticamente suponer proporción tan alto población , casi 13 % . combinar mejor tradición desear hacer bien , soler dedicarse actividad conllevar historia , ejemplo , medicinar , educación trabajo social carácter benéfico . individuo defensor , especialmente alborotador rebelde , soler ser meticuloso perfeccionismo y , pesar posponer coser , siempre confiar realizar trabajar tiempo . responsable siempre ir pasar allá , hacer posible superar expectativa deleitar demás , trabajar casar ."
ENTP,"surgir extraño yuxtaposición innovador , honesto compromiso , discutir incansablemente realidad creer , poniéndose lugar argumentar verdad perspectivo ."
INTJ,"ser natural conocimiento manifiesto temprano edad , menudo recibir título “ ratón biblioteca ” niño . si bien ser vestir insultar partir compañero , probable identificar orgulloso , disfrutar enormemente profundar amplio conocimiento . gustar compartir saber , confiar dominio temer elegir , preferir diseñar ejecutar plan brillante dentro campar lugar compartir opinión distracción “ poco interesante ” cotilleo ."
ISFP,"curioso : ideo bueno bueno , necesitar ver explorar mismo si ideo verdadero . trabajar girar tornar ciencia parecer malo combinación rasgo , visión audazmente artístico humanista menudo exactamente investigación necesitar avanzar , si libertar necesitar hacerlo ."
ISTP,"espontáneo racional : combinar espontaneidad lógico , cambiar mentalidad adaptarse nuevo situación esforzar , haciéndolos individuo flexible versátil ."
ISTP,"realizar especie búsqueda pos visión , simplemente explorar viabilidad nuevo interés hacer cambio tan brusco ."
ISFP,"sensible sentimiento demás valorar armonía . enfrentar crítico , ser desafiar personar alejarse situación tiempo suficiente quedar atrapar tensión momento . vivir momento ir ambos sentir , vez emocionar impetuoso argumentar enfriar , generalmente poder decir “ el pasar , pasar estar ” seguir adelantar si ocurrir ."
INTJ,"deber mentalidad abrir , forzar voluntad , independencia , confianza habilidad planificación arquitecto , capaz hacer cualquiera coser proponer . experto piratear cualquiera coser deparar vida , poder descomponerse aprender casi cualquiera sistema . luego usar ideo encontrar allí necesitar . tender elegir trabajo , diseñador sistema organizador político ."
ISTJ,"responsable : palabra especialista logístico promesa , promesa todo . especialista logístico preferir correr soler día adicional perder soñar entregar resultar decir hacer . lealtad fuerte sentimiento logístico , cumplir deber personar organización comprometer ."
ESTP,"si cuidar , poder quedarse demasiar atrapar situación , llevar coser demasiar lejos tratar despreciar desdén personar sensible , u olvidarse cuidar propio salud seguridad . cuatro ciento población , suficiente mantener coser lleno espíritu competitivo , tanto causar riesgo sistémico ."
ISTP,"privar reservar : notoriamente difícil conocer . verdadero introvertido , guardar asunto personal mismo y , menudo , preferir silenciar pequeño conversación ."
ENFP,"afortunadamente , saber cómo relajarse poder perfectamente pasar ser idealista apasionar lugar trabajar espíritu librar , imaginativo entusiasta pistar bailar , menudo brusquedad sorprender incluso amigo cercano . mezclar dar oportunidad relacionarse emocionalmente demás , dar compresión apreciar motivo amigo colega . creer mundo deber emplear tiempo reconocer expresar sentimiento , empatía sociabilidad hacer temer conversación natural ."
ENTJ,"freír despiadado : obsesión eficiencia creencia inquebrantable mérito racionalismo , especialmente profesionalmente , hacer increíblemente insensible consecución objetivo , descartar circunstancia personal , sensibilidad preferencia irracional irrelevante ."
ESTP,"original : combinar audacia practicidad , encantar experimentar nuevo ideo solucionar . arreglar coser manera nadie pensar ."
ENFP,"saber cómo relajarse : tratar discusión "" naturaleza cosmos "" activista : personar saber que , vez , tan importante simplemente divertirse experimentar alegría vida . rasgar intuitivo permitir saber hora sacudir coser , explosionar salvaje energía entusiasta poder sorprender incluso amigo cercano ."
ENTJ,"“ tu tiempo limitar , asir malgastar vivir vida personar . deje atrapar dogma , vivir pensar deber vivir . deje ruido opinión demás silenciar propio voz interior . importante , tener coraje hacer decir corazón intuición . alguno modo , saber querer llegar ser . demás secundario . ” líder nato . personar poseer don carisma confianza personal , proyectar autoridad lograr mundo búsqueda objetivar común . diferenciar contraparte , sentimental , caracterizar nivel racionalidad menudo despiadado ; utilizar energía , determinación inteligencia lograr cualquiera objetivar marcar conseguir . tal vez mejor tan representar tres ciento población , manera avasallar tipo tímido sensible , conformar mayor partir restar mundo . dar gracia mucho empresa institución ver cada día dar hacer siempre existir ."
ENTJ,"impacientar : personar necesitar tiempo pensar otro , retrasar intolerable pensamiento rápido . poder malinterpretar contemplación estupidez desinterés prisa , terrible error deber cometer líder ."
ENTP,"original : apego tradición , poder descartar sistema método existente reunir ideo disparar amplio basar conocimiento , creatividad crudo mantenerlas junto , formular nuevo ideo audaz . si presentar problema crónico sistémico dar rienda suelto resolverlos , debaters responder alegría descarar ."
INFP,"esplendor , cualidad permitir mediador comunicarse profundamente demás , hablar fácilmente metáfora parábola , comprender crear símbolo compartir ideo . forzar estilar comunicación intuitivo conducir obrar creativo ninguno sorpresa mediador famoso poeta , escritor actor . entenderse mismo cuál lugar mundo importante mediador , explorar ideo mediante proyección mismo trabajar ."
ESTP,"directo : habilidad perceptivo usar juego mental . preferir comunicarse claridad , preguntar respuesta directo objetivo . coser ser ."
ESTP,"hacer escuela entorno altamente organizar desafiar emprendedor . realmente , inteligente poder hacerlo bien , sino enfocar reglamentar lección clase , típico educación formal , alejar aprendizaje práctico disfrutar . necesitar gran madurez ver procesar mediar necesario fin , creer oportunidad interesante ."
ESTP,propenso riesgo : impaciencia llevar ingresar territorio desconocer pensar consecuencia largar plazo . emprendedor vez combatir intencionalmente aburrimiento riesgo adicional .
INFJ,"quemarse fácilmente : pasión , impaciencia mantenimiento rutina , idealismo privacidad extremo tender dejar poco opción desahogarse . probable personar agotar tiempo si encontrar manera equilibrar ideal realidad vida cotidiano ."
ENFP,"pensar exceso : tomar coser pie letra : buscar motivo subyacente incluso coser simple . raro perder soñar preguntándose alguien hacer hacer , poder significar hacer respectar ."
ESTP,"desafiante : encajonar . repetición , reglar duro , sentarse silenciar mientras dar conferenciar : asir vivir vida . orientar acción práctico . entorno escuela trabajar nivel entrar poder ser tan tedioso intolerable , requerir esforzar extraordinario partir empresario mantenerse enfocar tiempo suficiente llegar puesto libre ."
ESFP,"aunque siempre parecer , saber siempre protagonista ; observador sensible emocionar demás . personar menudo primero ayudar alguien confesar problema difícil ofrecer total voluntad apoyar emocional consejo práctico . embargar , si problema ellos , probable evitar conflicto afrontar . generalmente encantar drama pasión , foco crítico poder causar ."
ENTP,"¡ aquí reglar , tratar conseguir algo !"
INFP,mediador talento autoexpresión exteriorizar belleza secreto través metáfora personaje ficción .
INTP,"único coser realmente retener miedo , inquietar generalizar , fracasar . lógico tan propenso volver evaluar propio pensamiento teoría preocuparse perder alguno pieza crítico rompecabezas , poder estancarse perderse mundo intangible pensamiento nunca aplicar realmente . superación falto confianza mayor desafiar enfrentar , conseguir hacerlo ( gracia dote intelectual , grande pequeño , conceder vida ) , hacer luchar merecer penar ."
ENFP,"comunicador excelente : bueno habilidad tan fuerte personar nunca expresar ideo . disfrutar pequeño charlar conversación profundo significativo , do caro mismo monedar ellos , experto dirigir conversación hacia temer desear manera sentir completamente natural forzar ."
INTJ,"definir tendencia pasar vida si tablero ajedrez gigante , pieza cambiar constantemente función consideración inteligencia , siempre evaluar nuevo táctico , estrategia plan contingencia , constantemente dominar astucia colega mantener control situación , mientras maximizar libertar moverse . querer decir actuar concienciar , aversión mostrar actuar función emocionar , hacer parecer manera , explicar villano ficción ( y héroe incomprendido ) modelar conformar personalidad ."
INFJ,"raro representar menos ciento población ; embargar , dejar hollar mundo . innato idealismo moral , diferenciar idealista decisión determinación ; soñador ocioso sino personar capaz tomar medir concreto hacer realidad objetivo impactar formar positivo duradero ."
INTJ,"existir soledad cima y , ser tipo raro estratégicamente capaz , saber bien . abarcar apenar do ciento población , mujer especialmente raro constituir 0,8 % población ; menudo desafiar encontrar personar ideo afinar capaz seguir ritmar intelectualidad implacable maniobrar ajedrez . personar imaginativo decidir , ambicioso reservar , increíblemente curioso , malgastar energía ."
ESFP,hacer sentir tan infeliz darse contar encajonar circunstancia unirse amigo .
ENFP,"extremadamente independiente y , estabilidad seguridad , ansiar creatividad libertar ."
INTJ,"arrogante : poder llevar confianza demasiar lejos . poder creer falsamente solucionar problema asunto , luego llamarlo día , rechazar opinión oponer aquel creer intelectualmente inferior . falto respetar estándar social , poder ser insensible ofrecer opinión si consciente actitud habilidad social menos desarrollar ."
INTJ,"odiar entorno altamente estructurar : odiar seguir ciegamente ... cualquiera coser ... entender qué . disgustar figurar autoridad obligar obedecer ley reglar comprender propósito norma mismo . probable llevar bien cualquiera preferir coser "" siempre ser "" . embargar , cumplir estándar , incluso hacerlo poder ser gran problema , poder hacerles vida difícil necesario ."
ISTP,"especial dificultar predecir emocionar , extensión natural equidad , dar difícil medir emocionar motivación virtuoso . embargar , tendencia explorar relacionar través accionar lugar empatía , conducirlos situación frustrante . personar dificultad límite reglar , preferir libertar moverse salirse norma si necesario ."
ENTJ,"intolerante - "" ser caminar autopista "" - personar comandante notoriamente indiferente cualquiera ideo distraer objetivo principal , aun ideo basar consideración emocional . dudar segundar dejar claro hacer rodear ."
ESTP,"probabilidad llevar estilar vida conducta arriesgar . vivir momento sumergir acción , ojo huracán . personar emprendedor disfrutar drama , pasión placer , impactar emocional sino estimulante mente lógico . ver obligar tomar decisión importante basar inmediato realidad objetivo , procesar respuesta racional rápido estímulo ."
ESFP,"excelente habilidad personar : embargar , coser , artista encantar prestar atención personar . hablador , ingenioso casi nunca quedar coser discutir . personar personalidad , felicidad satisfacción provenir tiempo pasar personar disfrutar estar . sensible : artista ( especialmente turbulento ) emocional vulnerable crítico ; poder sentir ser arrinconar vez reaccionar mal . probablemente mayor debilidad artista , hacer difícil abordar cualquiera debilidad salir luz ."
ISTJ,"integridad personal fundamental ir allá propio mente ; aferrar norma reglar establecer importarles costar , informar propio error decir verdad , incluso consecuencia hacerlo poder ser desastroso . logistas , honestidad importante consideración emocional enfocar contundente hacer demás falso impresión frío incluso robótico . personar poder tener dificultad exteriorizar emocionar afectar , sugerir sentir o , peor aun , personalidad , doloroso ."
ENFP,"estresarse fácilmente : pensamiento excesivo propio beneficiar : activista , especialmente turbulento , sensible preocupar profundamente sentimiento demás . consecuencia popularidad menudo buscar ayudar orientación , llevar tiempo , fácil ver vez sentir abrumar , especialmente poder decir cada solicitud ."
ENFP,poder cambiar mundo ideo
ESTP,"desafiar hacer personar emprendedor usar propio criterio moral personar . reglar crear romperlas . pensamiento poco profesor secundario supervisor corporativo gustar compartir hacer gente emprendedor determinar reputación . si minimizar problema , aprovechar energía lograr concentrarse ignorar coser aburrir , forzar tener contar ."
ISFJ,"bueno habilidad práctico : mejor partir práctico hacer altruismo . si tarea rutinario rutinario , poder ver belleza armonía creer , saber ayudar cuidar amigo , familiar cualquiera necesitar . humilde tímido : manso heredar tierra , largar caminar si recibir ninguno reconocimiento . posiblemente mayor desafiar defensor , tan preocupar sentimiento demás negar dar conocer pensamiento , tomar cualquiera crédito debidamente ganar contribución . estándar mismo tan alto que , saber poder haber hacer mejor alguno aspecto menor tarea , menudo minimizar éxito completar ."
ENFJ,"autoestima fluctuante : protagonista definir autoestima si poder cumplir ideal y , vez , pedir crítico inseguridad confianza , siempre preguntándose poder hacer mejor . si lograr objetivar ayudar alguien decir ayudar , confianza mismo dudar caer picar ."
ENTJ,desarrollar ciencia relacionar humano
ESTP,"impacientar : mover propio ritmar mantenerse entusiasmar . disminuir velocidad alguien "" no entender "" tener concentrarse detallar demasiar tiempo extremadamente difícil emprendedor ."
ISTJ,"voluntario obediente : especialista logístico encarnar integridad accionar también , trabajar durar manteniéndose enfocar objetivo . paciente determinar , personar logístico cumplir obligación , punto ."
ENFJ,"protagonista sincero , bondadoso predicar ejemplo , hacer feliz llevar voz cantante unir motivar equipar entusiasmar contagioso ."
ENFP,perder pequeño “ chispo locura ”
INFP,"práctico : capturar imaginación mediador , poder descuidar cuestionar práctico mantenimiento diario placer simple . vez , personar llevar ascetismo descuidar comer beber mientras perseguir pasión causar ."
ESFP,"“ ser egoísta , impacientar inseguro . cometer error , control y , vez , difícil controlar . si poder tratar peor momento , entonces seguro merecer mejorar momento . ” si alguien espontáneamente comenzar cantar bailar , animador . quedar prendar emoción momento querer demás sentir manera . ninguno tan generoso tiempo energía tratar animar demás , ninguno hacer estilar tan irresistible . estrellar ..."
