tipos,descripcion
ENFJ,grande creyente gente
ENTJ,"strong - willed - tampoco rendir coser poner difícil - comandante esforzar lograr objetivo , realidad satisfacer enfrentar desafiar cada obstáculo carrera hacia líneo meter ."
ENTP,"lluvia ideo excelente : tan agradable debaters analizar problema ángulo encontrar mejorar solucionar . combinar conocimiento originalidad exponer cada aspecto temer cuestión , rechazar remordimiento opción funcionar presentar cada vez posibilidad , debaters insustituible sesión lluvia ideo ."
ISFJ,"verdadero altruista , responder amabilidad amabilidad comprometer trabajar personar creer entusiasmar generosidad ."
ESFJ,"preferir eludir conflicto , individuo emplear mucho energía establecer orden social preferir plan actividad organizar actividad límite preestablecer encuentro espontáneo . personar poner esforzar actividad planificar , fácil herir sentimiento si ideo rechazar si gente simplemente interesar . nuevo , importante recordar provenir mismo lugar , desinterés observación crítico hacia actividad organizar ; simplemente temer preferir ."
ESFJ,"inflexible : dar mucho importancia socialmente aceptable poder ser cauteloso , incluso crítico cualquiera coser convencional corriente principal . personar vez poder presionar demasiar propio creencia esforzar establecerlas corriente principal ."
INFJ,"mundo lugar llenar desigualdad , deber ser asir . ninguno adecuar crear movimiento corregir error , importar cuán grande pequeño ser . recordar mientras ocupar cuidar mundo , necesitar cuidar mismo . creativo : combinar imaginación vívido fuerte compasión , usar creatividad resolver desafío técnico , sino humano . personar advocate disfrutar encontrar solución perfecto alguien importar . fortaleza convertir excelente consejero asesorar ."
INTP,"hacer parecer fiable , realidad nadie entusiasta capaz detectar problema , penetrar factor interminable detalle abarcar temer desarrollar solución único viable lógico ; sí , esperar informe puntual progresar . personar compartir interesar actividad práctico día día mantenimiento , encontrar entornar genio creativo potencial poder expresar , límite tiempo energía disponer emplear desarrollar solución perspicaz imparcial . sabiduría comenzar preguntándose mismo"
ISTP,aburrir mundo acordar contigo
ESFP,"desenfocar : cualquiera coser requerir dedicación enfocar largar plazo desafiar particular artista . ámbito académico , materia denso inmutable , literatura clásico , difícil materia dinámico relacionar , psicología . trucar artista encontrar alegría día día objetivo amplio , hacer frente tedioso coser deber hacerse ."
ISFJ,"desafiar asegurarse hacer noto . tender subestimar logro aunque normalmente respetar bueno corazón , gente cínico egoísta aprovechar dedicación humildad haciéndoles trabajar luego ser recibir honorar . necesitar saber cuándo decir plantarse mismo si querer mantener confianza entusiasmar ."
ESFJ,conexión harmonioso
INTP,"particularmente exaltar , conversación rozar incoherencia intentar explicar conexión cadena conclusión lógico dar lugar formación último ideo . mucho vez , optar simplemente cambiar temer entender tratar decir , lugar tratar explicar coser formar simple ."
ISTP,"encontrar entornar poder trabajar bueno amigo entender estilar imprevisibilidad , combinar creatividad , humor enfocar práctico construir solucionar práctico coser , ofrecer año feliz construir coser útil contemplándolas exterior . optimista enérgico : soler altura proyectar u otro . alegre afable , personar ( especialmente asertivo ) raro vez estresan , preferir seguir corriente ."
ENTP,"experimentar cierto placer hacerse víctima , innovador disfrutar ejercicio mental cuestionar modo predominante pensamiento , hacer insustituible revisar sistema existente sacudir coser empujarlas hacia nuevo ingenioso direccionar . embargar , desastroso hora gestionar aspecto práctico día día implementar realmente sugerencia . individuo encantar lluvia ideo pensar grande , tratar evitar todo costa versar inmerso trabajar durar tedioso . innovador representar alrededor tres ciento población , bien permitir crear ideo original luego dar pasar atrás dejar orientar hacia trabajar tedioso minucioso , numeroso , manejar logístico implementación mantenimiento ."
ENTP,"vez asegurar posición particular , innovador necesitar recordar ideo llegar bueno término siempre ir depender ensamblar pieza : si necesitar tiempo “ ganar ” argumento emplear lograr consenso , innovador considerar simplemente apoyar necesario triunfar . hacer tan bien diablo , personar poder darse contar complejo gratificante desafiar intelectual entender perspectivo sentimental , argumentar consideración compromiso juntar progresar . conocido : debatir raramente dejar pasar bueno oportunidad aprender nuevo , especialmente concepto abstracto . información generalmente absorber ninguno propósito planificar , estudiar dedicar , personar simplemente encontrar fascinante ."
INTJ,"demasiar analítico : temer repetir discutir fortaleza habilidad analítico . fortaleza fallarles factor importante . relacionar , todo complejidad , menudo resistir explicación claro . poder ser crítico y , vez , alcanzar alto nivel minuciosidad exigente tratar otro . punto , probable mucho personar , excepción amigo extremadamente leal comprensivo , huir , vez volver ver ."
ENFJ,"protagonista vulnerable caer trampa : enorme capacidad reflexionar analizar propio sentimiento , si ver demasiar atrapar situación difícil personar , poder desarrollar especie hipocondría emocional ver problema personar mismo intentar arreglar mismo realidad mal . si llegar ver frenar limitación experimentar , posible protagonista problema ver allá dilema servir ayudar . suceder , importante detenerse autoreflexionar distinguir realmente asunto independiente estudiar perspectivo ."
ISFP,"artístico : poder mostrar creatividad manera tangible belleza deslumbrante . escribir canción , pintar emoción presentar estadístico gráfico , formar visualizar coser resonar audiencia . ferozmente independiente : libertar expresión menudo principal prioridad aventurero . cualquiera coser interferir ese , tradición reglar estricto , creer sensación opresión aventurero . hacer académico rígidamente estructurar trabajar desafiar ."
ISFP,"imaginativo : ser tan consciente emocionar demás , utilizar creatividad perspicacia crear ideo audaz hablar corazón personar . si bien difícil explicar calidad currículum , vívido imaginación espíritu exploratorio ayudar manera inesperado ."
ESFP,"original : tradición expectativa secundario artista , si contar . artista encantar experimentar nuevo estilo constantemente encontrar nuevo formar sobresalir multitud ."
ENTJ,"enérgico : lugar encontrar procesar imponer impuesto comandante , animar , realmente disfrutar llevar equipo hacia adelantar medir implementar plan objetivo ."
ENTP,"táctico deber confundirse comprensión mutuo buscar grupo diplomático ; innovador buscar constante conocimiento ¿ qué mejor manera ganar atacar defender ideo , ángulo , punto vestir ?"
INTJ,"independiente decisivo : creatividad , confianza formar individuo mantener solo responsabilizar accionar . figurar autoridad impresionar arquitecto , tampoco convención social . importar cuán popular algo , si mejor ideo , oponer cualquiera promover plan . ideo racional mal , feliz aplicar estándar mismo ."
ISTJ,"dedicación excelente cualidad , permitir lograr grande coser , debilidad fundamental personar menos escrúpulo aprovechar . buscar estabilidad seguridad , considerar deber mantener bueno funcionamiento poder descubrir compañero trabajar parejo endosar responsabilidad saber siempre ir aceptar . soler guardar opinión mismo dejar hecho hablar solo , pasar bueno tiempo evidenciar observable contar todo historia ."
ISTJ,"personar deber recordar cuidar mismo ; dedicación obstinar estabilidad eficiencia comprometer objetivo largar plazo medir demás apoyar cada vez ellos , crear tensión emocional ser expresar año , salir luz último hora demasiar tardar arreglarlo . si poder encontrar compañero trabajar parejo realmente apreciar complementar cualidad , disfrutar luminosidad , claridad confianza ofrecer , dar contar papel estabilizador tremendamente satisfactorio saber formar partir sistema funcionar . honestar directo : integridad corazón logístico . manipulación emocional , juego mental mentira tranquilizador ir preferencia especialista logístico manejar realidad situación enfrentar simple simple honestidad ."
ESFP,"aversión conflicto : artista vez ignorar evitar conflicto completar . tender decir hacer necesitar salir talar situación , luego pasar divertir ."
ISFP,venturero siempre saber cuál cumplir elogiar ablandar corazón decir riesgo irresponsable imprudente .
ESTP,"teoría , concepto abstracto largo discusión temer global consecuencia captar interés emprendedor tiempo . hablar mucho energía bueno dosis inteligencia , gustar hablar coser o , mejor aun , simplemente hacerlas . lanzar acción pensar corregir error marchar lugar sentarse hacer nadar , preparar imprevisto disponer solucionar . nunca confundir movimiento acción"
ENFJ,"líder natural : buscar autoridad mismo , protagonista menudo terminar rolar liderazgo pedir otro , alentar admirador fuerte visión positivo . demasiar idealista : personar poder ser tomar sorpresa descubrir que , circunstancia naturaleza , simplemente malentendido , personar luchar desafiar principio adoptar , bien intencionado ser . probable sentir lástima oposición ira , poder ganarse reputación ingenuidad ."
ESTP,"vez , observación acción instantáneo justar necesitar , entorno empresarial y , todo , situación emergencia ."
ENFJ,"personar altruista apasionar , vez incluso demasiar , probable miedo sufrir adversidad defender personar ideo creer . extrañar protagonista famoso político influyente líder cultural ; querer liderar caminar hacia futuro brillante , dirigir nación hacia prosperidad liderar pequeño equipar softball ligar victoria disputar . tolerante : protagonista verdadero jugador equipar , reconocer significar escuchar opinión personar , incluso contradecir suyo . admitir todo respuesta y , menudo , receptivo disenso , siempre seguir ser constructivo ."
ENTJ,"arrogante : comandante respetar pensamiento rápido convicción firme , propio cualidad despreciar coincidir . relación desafiar mayoría tipo tal vez tímido derecho propio , parecer lado dominante ."
INFP,"dedicar trabajador : mientras centrar desafío momento poder darse vencer coser poner difícil , mediador ( especialmente asertivo ) beneficiar visión largar alcanzar ayudarlos superarlos . saber hacer significativo dar personar propósito incluso coraje tratar lograr creer . demasiar idealista : mediador menudo llevar idealismo demasiar lejos , preparándose decepción que , vez , suceder coser malo mundo . cierto nivel personal , mediador poder idealizar parejo , sino idolatrarlas , olvidar nadie perfecto ."
ENFP,"embargar , individuo activista tener cuidar confiar demasiar intuición , asumir anticipar demasiar motivación amigar , poder leer mal señalar frustrar plan enfocar sencillo hacer simple . estrés social pesadilla mantener amante armonía despierto noche . sensible entrar conflicto alguien , ambos sentir ."
ENTJ,"si alguien respetar capaz enfrentarse intelectualmente , capaz actuar precisión calidad igual suyo . individuo comandante habilidad especial hora identificar talento demás , ayudar esfuerzo formar equipo ( ya nadie , importar talentoso ser , hacer mismo ) tarea evitar demostrar demasiar arrogancia condescendencia . embargar , habilidad particular señalar fracaso demás manera frío insensible , aquí realmente empezar tener problema ."
ISTP,"insensible : usar lógico , incluso intentar encontrarse mitad caminar empatía sensibilidad emocional , raro vez parecer salir bien , si decir algo ."
ISFJ,"confiable paciente : lugar ofrecer apuro esporádico emocionar dejar coser mediar terminar , meticuloso cuidadoso , adoptar enfocar constante inclinar necesidad situación suficiente lograr objetivo final . asegurar coser hacer alto nivel , sino menudo ir allá requerir ."
ESFJ,"“ anímense , elévense fortalézcanse otro . energía positivo irradiar hacia percibir nosotros . ” personar compartir ser , palabra mejor , popular , sentir , tratar común , representar doce ciento población . escuela secundario , quarterback equipar , establecer pautar , centrar atención dirigir equipo hacia triunfar fama . edad , seguir gustar apoyar amigo ser querido , organizar reunión social hacer posible asegurarse mundo feliz ."
INTJ,"paradoja mayoría observador , capaz vivir evidente contradicción embargar sentir , menos vestir puramente racional . ejemplo , mismo tiempo idealista idealista ácido cínico , conflicto parecer imposible . deber tipo tender creer esforzar , inteligencia consideración , imposible , mientras mismo tiempo creer gente demasiar perezoso , miope egoísta lograr realmente resultar fantástico . embargar , visión cínico realidad probable detener desear lograr resultar considerar importante ."
ESTJ,"consciente entornar vivir mundo hecho claro verificable ; confiar totalmente conocimiento que , incluso fuerte resistencia , aferrar principio sostener claro visión aceptable . opinión tampoco palabra vacío , disponer sumergirse proyecto desafiante , mejorar plan acción ordenar información progresar hacer incluso tarea complicar parecer fácil abordable ."
ISFP,"sensible demás : relacionar fácilmente emocionar demás , ayudándoles establecer armonía bueno voluntad , minimizar conflicto ."
ISFP,"vivir mundo variopinto , sensual , inspirar relacionar personar ideo . aventurero disfrutar reinterpretando conexionar , reinventar experimentar mismo nuevo perspectivo . ninguno explorar experimentar formar . creer sensación espontaneidad hacer parecer impredecible , incluso amigo cercano ser querido ."
ENFP,"probablemente , encontrar cualidad irresistible , si encontrar causar despierto imaginación , aportar energía mucho vez llevar centrar atención , considerar compañero líder gurú , siempre aquí activista , amante independencia , querer estar . aun peor si ver acosar rutinario tarea administrativo mantenimiento generalmente acompañar posición liderazgo . autoestima depender capacidad encontrar solucionar original necesitar saber libertar ser innovador ; poder perder rápidamente paciencia entristecerse si encasillar papel aburrir ."
INFJ,"perfeccionista : defensor definir búsqueda ideal . si bien cualidad maravilloso sentir , situación ideal siempre posible : político , negocio , romance . defensor , especialmente turbulento , menudo abandonar ignorar situación relacionar saludable productivo , siempre creer poder haber mejor opción futuro ."
ISFJ,"imaginativo observador : imaginativo utilizar cualidad accesorio empatía , observar emocional demás ver coser perspectivo . pie firmemente plantar soler , imaginación práctico , aunque encontrar coser bastante fascinante inspirador ."
INTJ,impedir actitud correcto lograr objetivar
ESTJ,"leal , paciente confiable : trabajar ejemplificar veracidad confiabilidad , considerar estabilidad seguridad importante . decir hacer algo , mantener palabra convertir miembro responsable familia , empresa comunidad ."
ENTP,"gustar asunto práctico : debatir interesar ​​en poder ser : concepto maleable ideo plan poder adaptar debatir . tratar detalle concreto ejecución cotidiano , talento creativo innecesario , sino realmente contraproducente , perder interés , menudo consecuencia plan nunca ver luz día ."
INFP,"si cuidar , mediador poder perderse búsqueda bueno descuidar mantenimiento diario exigencia vida . vez cuando , mediador derivar profundo reflexión disfrutar contemplación hipotético filosófico , cualquiera personalidad . si controlar , comenzar perder contactar retirándose “ modo ermitaño ” , requerir gran cantidad energía partir amigo parejo traerlos volver mundo real ."
INTJ,"mente abrir : abrir nuevo ideo siempre discutir bien . personar incluso ( tal vez especialmente ) abrir ideo ir si pensamiento sólido . menudo aplicar apertura independencia pensar asunto estilo vida alternativo . combinar disgustar reglar tradición , fácil ver cómo poder inclinarse hacia punto vestir social tolerante ."
ISTP,"aprender tipo líneo firme norma comportamiento aceptable ; sensible querer escuchar bromar insensible ciertamente hacer uno , participar tontería , incluso aunque grupo disponer . si situación cargar emocional , violar límite tener consecuencia tremendo ."
ISTP,"comportamiento arriesgar : terquedad , dificultar emocionar demás , concentración momento aburrimiento fácil llevar empujar límite innecesario inútil , diversión . saber aumentar conflicto peligrar ver dónde ir , tener consecuencia desastroso si perder control situación ."
ISFJ,"demasiar altruista : ver agravar reforzar maravilloso calidad altruismo defensor . ser personar tan cálido bondadoso , disponer dejar coser pasar , creer coser mejorar pronto , agobiar demás aceptar ofertar ayudar , mientras problema aumentar ayudar ."
INFJ,"extremadamente privar : tender presentarse culminación ideo . deber partir creer ideo , extremadamente privar tratar vida personal . usar imagen evitar tener abrirse realmente , incluso amigo cercano . confiar nuevo amigar ser aun desafiante defensor ."
ENTJ,"expresión emocional fuerte ninguno grupo analista , deber carácter social , distanciar separar emocionar especialmente conocido públicamente , padecer formar directo gran número personar . especialmente entornar profesional , simplemente tolerar personar considerar ineficiente , incompetente vago . individuo comandante , manifestación emocional muestra debilidad , fácil hacer enemigo enfocar : hacer bien recordar depender totalmente tener equipar aptar , lograr objetivo sino sentirse legitimar sentir miembro equipar disponer comunicar opinión , ser , curiosamente , sensible ."
ISTP,"aunque carácter reservar interés cuestionar práctico poder hacer parecer simple simple vestir , realidad enigmático . amable reservar , tranquilo espontáneo mismo tiempo , curioso haberse poder concentrar estudio formal , identificar ser complicar , incluso partir amigo ser querido . poder parecer leal constante tiempo , tender acumular reservar energía impulsivo explotar previo avisar tender llevar interesar hacia direccionar totalmente nuevo ."
INFJ,"creer ayudar demás objetivar vida , mientras personar poder encontrar participar esfuerzo rescatar hacer obrar benéfico , verdadero pasión llegar fondo cuestión personar ser rescatar ."
ESFP,"fácilmente aburrir : emoción constante , artista encontrar formar crearlo mismo . comportamiento arriesgar , autocomplacencia placer momento plan largar plazo coser artista involucrar demasiar frecuencia ."
INFP,"tomar coser personalmente : mediador menudo tomar desafío crítico personalmente , lugar inspirarlos reevaluar posicionar . evitar conflicto posible , mediador dedicar gran cantidad tiempo energía tratar alinear principio crítico mediar satisfacer todo ."
ENTP,"frustrar innovador , ver cómo diversión pendenciero cerrar mucho puerta , mucho vez darse contar , traspasar umbral demás cuestionar creencia dejar lado sentimiento . tratar demás deber hacerlo , innovador gustar mimar personar andar rodeo , pedir favor . individuo sentir respetar visión , confianza , conocimiento agudo humor , menudo dificultad utilizar cualidad basar lograr amistad profundo relacionar romántico ."
ENFJ,"interés protagonista demás sincerar , casi exageración ; creer alguien , poder llegar involucrarse demasiar problema confiar demasiar ellos . suerte , confianza tender ser profecía auto cumplir , altruismo autenticidad inspirar aquel preocupar llegar ser mejorar personar . si cuidar , poder ser demasiar optimista animar ocasionar demás ir allá realmente preparar disponer ir ."
ISTJ,"mente astuto , basar hecho , preferir autonomía autosuficiencia depender alguien algo . creer depender demás debilidad , pasión servicio , dependencia integridad personal impecable prohibir caer trampa ."
ISTJ,"decir ir lograr algo , hacer , cumplir obligación importar coste personal sentir desconcertar personar mantener palabra mismo respetar . combinar vagueza falto honradez manera rápido presenciar lado malo logistas . él , personar menudo preferir trabajar solo menos establecer claramente autoridad jerárquico , poder establecer alcanzar objetivo debatir preocuparse fiabilidad partir ."
ISTJ,relaciónate personar noble si apreciar propio reputación
INFJ,"altruista : fortaleza usar bien . participar ninguno acción promover creencia beneficiarse . fuerte creencia tomar accionar hacer tratar promover ideo realmente creer hacer mundo lugar mejor . sensible : alguien cuestionar criticar principio valorar defensor , probable recibir respuesta alarmantemente fuerte . personar advocate vulnerable crítico conflicto . cuestionar motivo caminar rápido lado malo ."
INTJ,"mente rápido , imaginativo estratégico : enorgullecer mente aprovechar cada oportunidad mejorar conocimiento . mostrar forzar ​​flexibilidad pensamiento estratégico . altamente curioso siempre listo desafiar intelectual , ver coser ángulo diferente . utilizar creatividad planificar posibilidad imprevisto ."
ISTP,"mayor problema probablemente enfrentar actuar menudo demasiar pronto , dar sentar naturaleza permisivo suponer demás igualar . primero contar chistar sensibilidad , involucrarse demasiar proyectar ajeno , pelearse jugar , cambiar plan repente surgir interesante ."
ISFJ,"tomar coser demasiar personalmente : problema separar situación personal impersonal ; después todo , cualquiera situación seguir ser interacción do personar , cualquiera negatividad conflicto crítico trasladarse vida profesional vida personal , viceversa ."
ENTJ,"mal manejar emocionar : todo bravuconada , juntar suponer supremacía racionalismo , hacer distanciar propio expresión emocional y , vez , despreciar demás . personar menudo pisotear sentimiento demás , lastimar inadvertidamente parejo amigo , especialmente situación cargar emocional ."
ESFJ,respetar sabiduría liderazgo
ESFJ,"fondo , criatura social esforzar saber hacer amigo . discutir teoría científico debatir político europeo captar interés tiempo . individuo importar asunto tangible práctico , además mejorar status social observar demás . paso alrededor plato preferir , hacer posible utilizar poder bien ."
INFP,"mediador guiar principio , lógico , excitación practicidad . decidir cómo avanzar , contar aspecto honor , belleza , moralidad virtud ; mediador guiar pureza intención , recompensar castigo . personar orgulloso cualidad razón , mundo entender conllevar sentimiento conducir aislamiento ."
ESFJ,"conciliarse sensibilidad personar mayor desafiar cónsul ; gente ir desacordar ir criticar , aunque doler , partir vida . mejor hacer mejor saber hacer : ser modelar seguir , cuidar mano disfrutar tanto personar realmente apreciar esfuerzo hacer . habilidad práctico sólido : excelente gerente tarea diario mantenimiento rutina , disfrutar asegurarse cercar bien atender ."
ESFJ,"reacio innovar improvisar : asir poder ser crítico comportamiento "" inusual "" demás , poder disponer salir propio zona confort , generalmente temor ser ( o simplemente parecer ) diferente ."
ISTJ,... porque mejor mal acompañar
ESTP,"lleno pasión energía , complementar mente racional , aunque vez distraído . motivador , convincente variopinto , líder natural grupo , llevar mundo caminar menos transitar ofrecer vida entusiasmar querer ir . destinar cualidad fin constructivo gratificante verdadero desafiar emprendedor . negrito : personar lleno vida energía . mayor alegría empujar límite descubrir usar nuevo coser ideo ."
ESFJ,"sensible cálido : ayudar garantizar estabilidad , buscar armonía preocupar profundamente sentimiento personar , cuidar ofender herir nadie . fuerte jugador equipar , situación ganar - ganar hacer sonrisa ."
INTP,valer penar vivir vida examinarla
ENFP,"personar sociable querer agradar , caracterizar carácter visionario , permitir leer líneo curiosidad energía . soler ver vida gran complejo rompecabezas , conectar , diferenciar analista , tender ver rompecabezas seriar maquinación sistémico , ver través prisma emoción , compasión misticismo , siempre buscar significar profundar ."
ISTJ,"tranquilo práctico : ninguno promesa significar si especialista logístico perder estribo desmoronar cualquiera señal dificultar : mantener pie soler tomar decisión claro racional . preferencia personar factor tener contar procesar , especialista logístico trabajar aprovechar máximo cualidad individual , decisión tomar contar eficacia empatía . mismo aplicar crítico , demás mismo ."
INTP,"parecer ir rumbo , soñar fin , procesar pensamiento incesante ideo zumbar mente despertar . pensamiento constante tener efecto hacer ver pensativo distante , mucho vez debatir propio mente , realmente bastante relajar agradable gente conocer compartir interesar . embargar , ser sustituir timidez abrumador individuo encontrar personar desconocido , bromar poder convertirse rápidamente antagonismo agresivo si creer conclusión teoría lógico ser criticar ."
ESTJ,"demandar líder alto sociedad democrático contar representar menos 11 % población , extrañar político empresario famoso mundo ser ejecutivo . sólido creencia derecho , deber ganar , personar predicar ejemplo , demostrar dedicación honestidad rechazar total pereza engañar , trabajar . si alguien declarar trabajar manual durar excelente manera desarrollar carácter , ejecutivo ."
