tipos,descripcion
INTJ,"irradiar confianza mismo aura misterio , interesante observación , ideo original formidable poder impulsar cambiar través forzar voluntad forzar personalidad . vez poder parecer tendencia desmontar reconstruir todo ideo sistema entrar contactar , emplear perfeccionismo incluso moralidad trabajar . cualquiera talento seguir pasar proceso arquitecto , peor aun , ver razón ser , probable perder inmediato permanentemente respetar ."
ESTP,"desestructurado : ver oportunidad : solucionar problema , avanzar , divertirse aprovechar momento , menudo ignorar reglar expectativa social procesar . hacer coser hacer , crear consecuencia social inesperado ."
INFJ,"perspicaz : ver través deshonestidad motivo falso , superar táctico manipulación venta entrar discusión honesto . defensor ver cómo personar evento conectar . entonces poder usar información llegar meollo asunto ."
INFP,"mente abrir flexible : actitud vivir dejar vivir natural mediador , gustar limitar reglar . mediador beneficiar dudar , mientras principio ideo cuestionar , apoyar derecho demás hacer pensar correcto ."
ISTP,"compromiso disgustar : compromiso largar plazo particularmente oneroso virtuoso . preferir tomar coser día día , sensación encerrar tiempo francamente opresivo . ser desafiar particular relacionar romántico virtuoso ."
ENFP,"enérgico entusiasta : mientras observar , formar nuevo conexionar ideo , callar , entusiasmar hallazgo compartir cualquiera escuchar . entusiasmar contagioso doblar beneficiar darles campañantes oportunidad establecer conexionar social , brindarles nuevo fuente información experiencia , encajar opinión nuevo amigo ideo existente ."
INFJ,"siempre deber tener causar : defensor quedar tan atrapar actividad cualquiera tarea engorroso interponer visión ideal profundamente desagradable . gustar saber dar paso concreto hacia objetivo . si tarea rutina sentir interponer , peor aun , ninguno objetivar absoluto , sentir inquieto decepcionar ."
INFJ,"embargar , importante recordar deber cuidarse mismo . pasión convicción llevar allá agotamiento si entusiasmar ir mano , poder quedarse exhausto , ponerse enfermo estresarse . hacer especialmente evidente enfrentar conflicto crítico ; sensibilidad obligar hacer posible evitar ataque aparentemente personal , circunstancia inevitable poder luchar formar inútil irracional ."
ISTJ,"siempre pie letra : especialista logístico creer coser funcionar mejor reglar claramente definir , hacer reacio doblegar reglar probar coser nuevo , incluso inconveniente mínimo . entorno verdaderamente desestructurados dejar especialista logístico prácticamente paralizar ."
ENTP,"“ seguir caminar pensador independiente , inseguro . exponer ideo peligro controversia . decir pensar temer menos tildar excéntrico estigma conformidad . cuestionar parecer importante , ponte pie hazte tener contar cualquiera preciar . ” individuo extremar diablo , destacar procesar deshilachar argumento creencia dejar jirón derivar viento ver . diferenciar decidir , innovador hacer tratar lograr alguno propósito profundar alguno meter estratégico sino sencillo razón divertir . nadie amar procesar combatir mental innovador , dar oportunidad ejercer rápido ingeniar esforzar , amplio basar conocimiento acumular capacidad conectar ideo disparar demostrar punto ."
ENTP,"resultarle difícil concentrarse : mismo flexibilidad permitir debaters proponer plan ideo tan original hacer readaptar demasiar frecuencia demasiar frecuencia , incluso dejarlos caer completar medir disminuir emoción inicial surgir nuevo pensamiento . aburrimiento demasiar fácil debaters , pensamiento fresco solución , aunque siempre útil ."
ENFJ,"fiable : único irritar protagonista ideo decepcionar hacer creer . si posible , siempre contar protagonista cumplir ."
INTJ,"reglar , límite tradición anatema individuo arquitecto : deber abrir cuestionamiento reevaluación ; y , si ver modo hacerlo , soler actuar manera unilateral implementar método ideo técnicamente superior , vez insensible casi siempre ortodoxo ."
INTJ,"trabajador decidir : si atraer interés , architect poder dedicarse trabajar . menudo dedicar largo hora esforzar intensar . orientar objetivo , si tarea conducir claro relevante , esforzar cumplir tarea ."
ESTJ,todo digno defender creer justar ...
ESTJ,"prototipar clásico ciudadano modelar : ayudar vecino , defender legalidad tratar asegurarse mundo participar comunidad organización querer ."
INFP,"capacidad mediador lenguaje detener idioma materno ; considerar superdotado hora aprender segundar ( o 3 ) idioma . don comunicación conducir desear armonía partir mediador , ayudar seguir adelantar descubrir vocación ."
ESFP,"estético espectáculo : detenerse simple conjunto , artista inyectar creatividad artístico palabra accionar también . cada día actuación , artista encantar montar espectáculo ."
ENTJ,"ideo subyacente recorrer mente comandante poder ser asir comer : “ no importar si llamar c****n insensible , siempre seguir ser c****n eficiente ” ."
ESTJ,"difícil relajarse : necesidad respetar fomentar necesidad mantener dignidad , dificultar aflojamiento relajación riesgo parecer tonto , incluso diversión ."
INFP,"individuo verdadero idealista , siempre buscar alguno atisbar bondad , incluso peor personar peor acontecimiento , tratar encontrar formar hacer coser mejor . aunque vez considerar tranquilo , reservar , incluso tímido , mediador llamar interior pasión realmente brillar . constituir 4 % población , riesgo sentirse incomprendido desafortunadamente alto personar mediador , encontrar personar ideo afinar , armonía sentir fuente alegría inspiración ."
ENFP,"emplear tiempo explorar relacionar social , sentimiento ideo encontrar realmente sonar verdad . finalmente encontrar lugar mundo , imaginación , empatía coraje susceptible producir resultar increíble ."
ESFP,... y merecer brillar
ENFJ,"luchar tomar decisión difícil : si ver atrapar roca lugar difícil , protagonista poder sufrir parálisis , imaginar todo consecuencia accionar , especialmente si consecuencia humanitario ."
INFP,"gustar tratar dato : mediador menudo tan centrar panorama general olvidar bosque hacer árbol individual . mediador sintonía emocionar moral , hecho dato contradecir ideal , ser verdadero desafiar ellos ."
INTJ,reflexionar viajar
ENFJ,"demasiar sensible : si bien receptivo crítico , verlo herramienta liderar mejor equipar , fácil protagonista tomarlo demasiar seriar . sensibilidad hacia demás significar protagonista vez sentir problema tratar arreglar coser poder solucionar , preocupándose si hacer suficiente ."
ENTP,"hacer diablo ayudar personar innovador , desarrollar mejor ideo razonamiento demás sino mejor comprensión ideo oponer , innovador discutir ."
ESTP,"sociable : todo cualidad unir formar grupo natural líder emprendedor . buscar activamente : personar simplemente habilidad hacer excelente usar interacción social oportunidad establecer contacto . insensible : sentimiento emocionar segundo hecho "" realidad "" emprendedor . situación cargar emocionar asunto incómodo incómodo , honestidad contundente ayudar aquí . menudo problema reconocer expresar propio sentimiento también ."
ESFP,"mayor desafiar enfrentar menudo tan concentrar placer inmediato descuidar deber responsabilidad hacer posible lujo . análisis complejo , tarea repetitivo trabajar hacer coincidir estadístico consecuencia real actividad fácil animador . preferir confiar suerte oportunidad , simplemente pedir ayudar amplio círculo amigo . importante poner retar personal perder vestir coser largar plazo , ejemplo plan jubilación ingesta azúcar ; siempre alguien ahí pendiente coser ."
ESFJ,"gente encantar ser servicial disfrutar cualquiera papel permitir participar manera significativo , siempre saber valorar apreciar . especialmente evidente hogar , parejo padre leal dedicar . respetar jerarquía hacer posible posicionarse cierto autoridad casar trabajar , permitir mantener coser claro , estable organizar todo ."
INTP,"“ aprender ayer , vivir hoy , tener esperanzar mañana . importante dejar hacerse preguntar . ” bastante raro representar tres ciento población , definitivamente bueno ellos , hacer ser menos feliz ser “ común ” . enorgullecer inventivo creatividad , perspectivo único potente intelecto . conocido generalmente filósofo , profesor soñador , ser responsable descubrimiento científico largar historia ."
ISTJ,"crear hacer cumplir orden : objetivar principal cualquiera logístico ser eficaz elegir hacer , creer lograr mejor involucrar saber exactamente suceder qué . pautar claro personar infringir reglar establecer socavar esforzar raro vez tolerar especialista logístico . estructurar reglar fomentar confiabilidad ; caos creer contratiempo imprevisto plazo vencer ."
