tipos,descripcion
ESFP,"bien acoger siempre necesidad alegría pasarlo bien , voluntad probar nuevo divertir ; mayor alegría lograr demás pasar bien . poder charlar hora , vez cualquiera coser menos temer querer hablar , compartir emocionar ser querido bueno malo . si capaz mantener asunto orden , siempre disponer experimentar nuevo emocionante coser mundo ofrecer arrastrar conseguir amigo . negrito : artista conocido contenerse . desear experimentar experimentar , personar entertainer importar salir zona confort nadie desear ."
ESFJ,"bueno conectarse otro : cualidad unir hacer social , cómodo popular . gran necesidad "" pertenecer "" ninguno problema pequeño conversación seguir señalar social ayudarlos tomar papel activar comunidad . preocupar social : fortaleza relacionar debilidad principal : preocupación social influenciar , afecto mucho decisión tomar , potencialmente limitar creatividad mentalidad abrir ."
ISTJ,"soler hacer suposición ; preferir , cambiar , analizar entornar , comprobar hecho dar vía acción práctico . hacer coser tomar decisión transmitir hecho necesario lograr objetivar , esperar demás comprender situación inmediato tomar medir . tolerante indecisión , perder paciencia incluso rápidamente si caminar elegir presentar desafiar teoría impracticable , si ignorar detalle clavar ; si desafío convertir debatir requerir tiempo , poder llegar enfadarse formar airar medir acercar plazo ."
ISFJ,deber hacernos visible creer
ENFP,"resultar difícil concentrarse : explorador natural conexionar filosofía interpersonal , contraproducente hacer informar tps encontrar justar frente ellos . difícil mantener interés medir tarea desplazar hacia asunto rutinario , administrativo lejos concepto amplio ."
ESTJ,"juicio : fuerte convicción correcto , incorrecto socialmente aceptable . compulsión crear orden menudo extender todo coser todo , ignorar posibilidad do formar correcto hacer coser . dudar dejar "" desviar "" saber pensar , considerar deber arreglar coser ."
ENFJ,... los dificultad deber desanimarnos seguir apoyar causar considerar justo
ISFP,"vivir encontrar formar impulsar pasión . comportamiento riesgo apuesto deporte extremo común otro . afortunadamente , sintonía momento entornar permitir hacerlo mejor mayoría . disfrutar relacionándose demás poseer cierto irresistible encantar ."
ISTJ,"comercio tipo : igual tipo analista , especialista logístico orgulloso depósito conocimiento , aunque énfasis hecho estadístico concepto principio subyacente . permitir especialista logístico aplicarse variedad situación , recoger aplicar nuevo dato captar detalle situación desafiante natural . terco : hecho hecho , especialista logístico tender resistirse cualquiera ideo nuevo respaldar ellos . procesar tomar decisión objetivo hacer difícil personar logistician aceptar equivocar algo , cualquiera perderse detallar , incluso ellos ."
ENTP,perder oportunidad parecer tarea complicar
ESFJ,"menudo demasiar necesitar : deber escuchar apreciar mucho . si esfuerzo pasar desapercibido , personar poder comenzar buscar elogio , intentar asegurarse cuánto valorar ."
ISTP,"relajar : pesar este , poder mantenerse bastante relajar . vivir momento seguir corriente , negándose preocuparse demasiar futuro . obstinar : tan fácilmente ir flujo , poder ignorarlo completar y , general , moverse dirección poco disculpar sensibilidad . si alguien intentar cambiar hábito , estilar vida ideo través crítico , volverse bastante franco irritación ."
INTP,"encantar patrón detectar discrepancia declaración casi poder considerarse afición ; tanto , malo ideo mentirle lógico . hacer irónico palabra lógico siempre deber cogerse pinzar ; deshonesto sino personar tender compartir pensamiento desarrollar completamente utilizar altavoz ideo teoría debatir mismo compañero real conversación ."
ENFP,"popular amigable : todo adaptabilidad espontaneidad unir formar accesible , interesante emocionante , espíritu cooperativo altruista disposición amigable empático . llevar bien casi todo , círculo amigo extender todo partir . pobre habilidad práctico : tratar concebir ideo comenzar proyecto , especialmente involucrar personar , talento excepcional . desafortunadamente , habilidad mantenimiento , administración seguimiento luchar proyecto . personar práctico ayudar impulsar coser día día , probable ideo seguir ser ese : ideo ."
ISFP,"embargar , si crítico producir , terminar mal . poder controlar crítico decir amabilidad valorarla vestir servir ayudar llevar pasión hacia nuevo direccionar . si comentario mordaz menos maduro , poder perder estribo manera espectacular ."
ESTP,"perderse imagen grande : vivir momento hacer empresario extrañar bosque árbol . personar encantar resolver problema aquí ahora , tal vez demasiar . todo partir proyectar poder ser perfecto , proyectar seguir fallar si partir encajar sí ."
ESTP,"perceptivo : originalidad ver favorecer capacidad darse contar cuándo cambiar coser cuándo necesitar cambiar . pequeño cambio hábito apariencia destacar empresario , utilizar observación ayudar crear conexionar demás ."
INTP,"conocido brillante teoría implacable ; hacer , considerar tipo precisión lógico ."
ESFJ,"vulnerable crítico : ser especialmente desafiante cambiar tendencia reacio conflicto . poder ponerse defensivo lastimarse si alguien , especialmente cercano ellos , criticar hábito , creencia tradición ."
INFJ,"realmente compartir combinación único rasgo : aunque hablar suavidad , opinión sólido luchar descansar ideo creer . decidir carácter fuerte , raro vez usar energía beneficiar propio ; actuar creatividad , imaginación , convicción sensibilidad , sacar ventaja sino crear equilibrio . igualitarismo karma ideo atractivo abogar , soler pensar ayudar mundo usar amor compasión ablandar corazón tirano ."
ISFP,"mayor desafiar enfrentar planificar futuro . encontrar ideal constructivo basar objetivo trabajar meter creer principio positivo tarea fácil . diferenciar tipo personalidad , planificar futuro término activo jubilación . además , planificar accionar conducta contribución identidad construir portafolio experiencia , activo ."
ISTP,"genial crisis : todo creatividad práctico espontaneidad , extrañar natural situación crisis . personar generalmente disfrutar pequeño riesgo físico , miedo ensuciarse mano situación requerir ."
INTJ,“ no derecho opinión . derecho opinión informar . nadie derecho ser ignorante . ”
ESTP,"racional práctico : amar conocimiento filosofía , propio bien . divertir emprendedor encontrar ideo accionable profundizar detalle poder ponerlas práctico . si discusión completamente arbitrario , mejorar uso tiempo emprendedor ."
INTJ,"juicio : pleno confianza proceso pensamiento argumento racional casi definición correcto , menos teoría . práctico , consideración emocional historia influyente . débil personar calificar factor aquel aceptar ilógico . menudo descartar personar pensar manera inferior . hacer casi imposible escuchar ."
ISFJ,"leal trabajador : dar tiempo , entusiasmar convertir lealtad . defensor menudo formar vínculo emocional ideo organización dedicar . cualquiera coser cumplir obligación bueno trabajar durar fallo propio expectativa ."
ISFP,impredecible : gustar compromiso plan largar plazo . tendencia evitar activamente planificación futuro causar tensión relacionar romántico dificultad financiero adelantar vida .
INTP,"aquel querer mover mundo , mover 1"
ENFP,"“ no importar haz ganarte vida . querer saber ansiar , si atrever soñar lograr corazón desear . interesar edad tener . querer saber si disponer correr riesgo quedar tonto , amor , sueño , aventurar vivir . ” activista espíritu verdaderamente librar . menudo alma fiesta , menos interés emoción puro placer momento disfrutar relacionar social emocional demás . encantador , independiente , enérgico compasivo , representar 7 % hacer notar cualquiera muchedumbre ."
ENTP,"enérgico : dar oportunidad combinar rasgo examinar problema interesante , debaters poder ser realmente impresionante entusiasmar energía , tener reparo dedicar largo día noche encontrar solución . argumentativo : si disfrutar debaters , ejercicio mental debatir ideo , sagrado . tipo orientar consenso raro vez apreciar vigor destruir creencia método , generar gran tensión ."
ESTJ,"directo honestar : confiar hecho ideo u opinión abstracto . declaración información directo rey , ejecutivo devolver honestidad ( ya querer no ) ."
INFP,buscar valorar armonía : personar interés tener poder demás importar actitud dominante . preferir enfocar democrático trabajar durar garantizar escuchar cada voz perspectivo .
ESFP,"personar reconocer valor calidad , excelente rasgar personalidad . embargar , combinar tendencia malo planificación , hacer vivir encimar posibilidad ; tarjeta crédito especialmente peligroso . concentrar aprovechar oportunidad según llegar planificar objetivo largar plazo , poder descubrir falto atención hacer cierto actividad resultar inasequible ."
ESFP,"planificador pobre largar plazo : hacer , artista raro vez hacer plan detallar futuro . ellos , coser venir venir , raro vez molestar tomarse tiempo establecer paso consecuencia , creencia poder cambiar cualquiera momento , incluso coser poder planificar ."
INFP,"embargar , diferenciar sociable , mediador centrar atención únicamente personar , solo causar digno ; si dispersar demasiar quedar energía , incluso poder llegar sentirse abatir abrumar malo mundo poder arreglar . aspecto triste amigo mediador , depender visión optimista ."
ISTP,atrévase ser diferente
ESFJ,"altruista tomar seriar responsabilidad ayudar hacer correcto . diferenciar tipo idealista , personar basar brújula moral tradición establecer ley , respetar autoridad reglar lugar apoyar moralidad filosofía misticismo . embargar , importante recordar personar provenir diverso origen perspectivo parecer correcto siempre verdad absoluto ."
INFJ,"decisivo : creatividad , conocimiento inspiración poder tener impactar real mundo . deber poder seguir adelantar ideo convicción , forzar voluntad planificación necesario llevar cabo proyecto complejo final . personar advocate ver cómo deber ser coser ; actuar ideo ."
ISFP,"pesar este , claramente introvertido sorprender amigo aun dejar ser centrar atención ser mismo recargar energía . embargar , hacer solo significar personar sentir hacer nadar ; aprovechar momento introspección , evaluación reevaluación principio . lugar vivir pasar futuro , individuo aventurero dedicar tiempo pensar cuál identidad . regresar claustro , transformar ."
ISTJ,"juicio : opinión opinión hecho hecho , probable especialista logístico respetar personar acordar hecho , especialmente aquel ignorar voluntariamente ."
ENTP,"innovador llevar tiempo mayoría gente controlar capacidad natural : independencia intelectual visión librar tremendamente valioso cargar influir alguien estar , llegar nivel influenciar deber tener capacidad seguimiento resultar difícil personar innovador ."
ISTJ,"insensible : aunque intencionalmente durar , especialista logístico menudo herir sentimiento tipo sensible simple mantra honestidad mejor político . logístico poder tener contar emocionar , realidad respectar determinar formar efectivo decir decir ."
ENTP,"intolerante : menos personar poder respaldar ideo rondar combatir mental , probable debaters descartar ideo sino personar mismo . sugerencia resistir escrutinio racional valer penar molestarse ."
ISTJ,"“ mi observación siempre adecuar cumplimiento deber ... peor ejecutar do personar apenar hacer si emplear tres personar mismo . ” creer habitual , representar alrededor 13 % población . característico definitorio integridad , práctico dedicación incansable deber hacer núcleo vital mucho familia , asir organización defender tradición , norma estándar , oficina abogar , organismo regulador ejército . personar disfrutar tener responsabilidad accionar , enorgullecer trabajar hacer ; trabajar alcanzar meter , escatimar tiempo energía completar cada tarea importancia precisión paciencia ."
ENFP,"curioso : tratar nuevo ideo , interesar ​​en meditar : querer salir experimentar coser , dudar salir zona comodidad hacerlo . imaginativo mente abrir , ver todo coser partir gran misterioso rompecabezas llamar vida ."
ISFJ,"“ el amor crecer compartir . poder conseguir mismo ofreciéndolo demás . ” bastante particular , mucho cualidad desafiar definición característico individual . aunque sensible , poder ser fiero necesario proteger familia amigo ; aunque callar reservar , desarrollar habilidad tratar gente tener relacionar social sólido ; aunque buscar seguridad estabilidad , estan poder ser receptivo cambio siempre sentir comprender respetar . ocurrir tanto coser , personar sumo partir , formar usar punto fuerte definir quién ser ."
ISFJ,"sobrecargarse mismo : fuerte deber perfeccionismo combinar aversión conflicto emocional crear situación demasiar fácil sobrecargarse , ser sobrecargar otro , mientras luchar silenciar satisfacer expectativa todo , especialmente"
ESFP,"hablar , estético fuerte cualquiera personalidad . asear ropa casar bien amueblar , individuo ir siempre moda . saber atractivo mismo momento ver , miedo cambiar entornar reflejar estilar personal . curioso naturaleza explorar nuevo diseño estilo facilidad ."
INFP,"apasionar enérgico : captar imaginación mediador hablar creencia , entrar todo , dedicar tiempo , energía , pensamiento emocionar proyectar . timidez alejar podio , primero ayudar necesario ."
ISFP,"fácilmente estresado : vivir presentar , lleno emoción . situación descontrolar , personar ( especialmente turbulento ) poder cerrar , perder encantar creatividad característico favor rechinar diente ."
ISTP,"decisión surgir sentimiento realismo práctico corazón fuerte justicia directo , actitud “ tratar demás querer ser tratar ” , realmente ayudar explicar rasgo desconcertante virtuoso . lugar ser excesivamente prudente , evitar interferir personar interferir ellos ; personar propenso ir demasiar lejos aceptar asimismo represalia , bueno malo , partir jugar justar ."
ENTJ,"seguro mismo : poder hacer si plagar dudar : confiar habilidad , dar conocer opinión creer capacidad líder ."
ISTP,"“ yo querer vivir vida , vida diferente . querer ir mismo lugar día ver mismo gente hacer mismo trabajar . querer desafío interesante . ” encantar explorar mano ojo , tocar examinar mundo rodear racionalismo freír gran curiosidad . personar creador natural , pasar proyectar construir útil superfluo gustar hacerlo , aprender entornar medir avanzar . menudo mecánico ingeniero , encontrar mayor gozar ensuciarse mano desarmar coser volver armarlas , mejor antes . explorar ideo través creación , solución problema , ensayar error experiencia primero manir . disfrutar personar interesar proyecto vez siquiera importar este meter espaciar suponer , condición personar interferir principio libertar virtuoso , abrir devolver interés ."
INTP,"además , probable entender ninguno manera quejar emocional amigo ir encontrar basar apoyar emocional . personar preferir hacer sugerencia lógico formar resolver cuestión fondo , perspectivo siempre bien recibir compañero sentimental . probable extender mayoría convención objetivo social , planificación cenar boda , preocupar originalidad resultar eficiente ."
ESTJ,"incómodo situación convencional : fuerte adherente tradición y , repente ver obligar probar solucionar desear , sentir incómodo estresados . nuevo ideo sugerir método suficientemente bueno , abandonar siempre funcionar favor aun fallar poner riesgo imagen confiabilidad ."
ISFJ,"reacio cambiar : desafío poder ser particularmente difícil abordar defensor valorar tradición historia decisión . situación vez necesitar llegar ruptura persuadir circunstancia , fuerte ser querer , cambiar rumbo ."
ENTJ,"carismático inspirador : cualidad combinar crear individuo poder inspirar vigorizar otro , personar realmente querer ser líder , vez ayudar lograr objetivo menudo ambicioso nunca poder terminarse solo . obstinar dominante : vez , todo confianza forzar voluntad poder ir demasiar lejos , demasiar capaz cavar talón , tratar ganar cada debatir empujar visión , ellos ."
ISFP,"si objetivo principio noble , poder actuar generosidad abnegación increíble , ocurrir personar aventurero establecer identidad centrar mismo actuar egoísmo , manipulación interés . importante recordar deber actuar convertirse querer ser . desarrollar mantener nuevo hábito suceder formar natural , dedicar tiempo cada día comprender motivación permitir utilizar punto fuerte perseguir querer . encantador : personar relajar cálido , actitud "" vivir dejar vivir "" naturalmente hacer agradable popular ."
INTJ,"deber confundirse impulsividad ; esforzar seguir ser racional , importar atractivo poder ser objetivar final , cada ideo , generar internamente absorber mundo exterior , deber pasar despiadado siempre presentar filtrar “ ¿ este ir funcionar ? ” . mecanismo aplicar momento todo coser todo personar , aquí menudo individuo meter problema ."
ENFJ,"carismático : encantar popularidad cualidad protagonista espadar . instintivamente saber cómo captar audiencia captar ánimo motivación manera permitir comunicarse razón , emoción , pasión , moderación , situación . imitador talentoso , protagonista poder cambiar tono formar reflejar necesidad audiencia , mientras mantener propio voz ."
ESTJ,"excelente organizador : compromiso verdad estándar claro hacer líder confiable capaz . personar problema distribuir tarea responsabilidad manera justo objetivo , convertir excelente administrador . inflexible terco : problema tan obsesionar funcionar descartar demasiar frecuencia poder funcionar mejor . opinión demostrar , ejecutivo reacio confiar opinión tiempo suficiente oportunidad ."
ENTJ,"pensador estratégico : ejemplificar diferenciar gestión crisis momento momento navegación desafío paso plan grande , conocido examinar cada ángulo problema resolver problema momentáneo , sino hacer avanzar proyectar solucionar"
INFJ,"“ cada hombre deber decidir si ir caminar luz altruismo creativo oscuridad egoísmo destructivo . ” resultar fácil establecer relacionar demás talento especial usar lenguaje cálido , sensible , hablar término humano lugar puro hecho . amigo colega ver extrovertido , hacer bien recordar necesitar tiempo mismo fin relajarse recargar energía , alarmarse demasiar repente desaparecer . cuidar esmerar sentimiento demás esperar devolver favor ; vez significar darles espaciar necesitar día ."
ISTP,"disfrutar echar manir compartir experiencia , personar importar , lástima tan poco , representar cincar ciento población . mujer virtuoso común , rolar género típico sociedad esperar encajar ellos ; menudo ver marimacho niño ."
ISFJ,"gente grupo maravilloso : raro vez sentir hacer mientras causar digno resolver . capacidad relacionarse demás formar íntimo rival introvertido ; alegría experimentar usar relacionar mantener familia unir feliz , regalar involucrar . especialmente cómodo centrar atención poder sentirse culpable ponerse medalla esfuerzo equipar , si asegurar esfuerzo reconocer propenso sentir nivel satisfacción hacer tipo poder soñar . apoyar : ayudante universal , compartir conocimiento , experiencia , tiempo energía cualquiera necesitar , aun amigo familiar . personar esforzar situación ganar - ganar , elegir empatía juicio siempre posible ."
ENFJ,"altruista : unir cualidad desear inquebrantable protagonista hacer bien comunidad , propio hogar escenario global . afectuoso desinteresar , protagonista realmente creer si poder unir personar , poder hacer mundo bien ."
ESTP,"“ lo vida aventurar atrevido nadar . ” individuo emprendedor siempre lograr impactar entornar inmediato ; mejor manera detectarlos fiesta buscar remolinar gente revolotear alrededor pasar grupo otro . hacer reír entretener humor enérgico práctico ; emprendedor encantar ser centrar atención . si pedir miembro audiencia subir escenario , hacer hacer subir amigar tímido ."
ENTJ,"realmente poderoso cultivar imagen ser importante universo , mucho ocasionar ser . personar recordar prestigiar provenir únicamente propio accionar sino trabajar equipar sostener , importante reconocer contribución , talento necesidad , especialmente perspectivo emocional , redar apoyar . si individuo comandante capaz combinar enfocar emocionalmente aceptable juntar fortaleza , aun adoptar mentalidad “ fingir lograrlo ” , recompensar relacionar profundo satisfactorio todo desafiante victoria poder manejar . eficiente : ver ineficiencia problema mismo , sino alejar tiempo energía objetivo futuro , elaborar sabotaje consistir irracionalidad pereza . personar comandante erradicar comportamiento querer ir ."
ENTJ,felicidad encontrar alegría conseguir meter
ESFJ,"demasiar desinteresar : lado vez intentar establecer valor atención , abrumar rápidamente aquel necesitar , último instancia bienvenido . además , menudo descuidar propio necesidad procesar ."
ESTP,mayoría personar escuchar suficiente
ESTJ,"“ uno bueno orden fundamentar todo coser . ” representante tradición orden , utilizar conocimiento correcto , incorrecto socialmente aceptable unir familia comunidad . adoptar valorar honestidad , dedicación dignidad , personar valorar claridad asesoramiento orientación , ofrecer voluntariamente líder momento difícil . hacer galo capacidad unir personar , mucho vez adoptar papel organizador comunidad trabajar durar juntar celebración evento local defensa valorar tradicional , mantener junto familia comunidad ."
INFP,"suerte , flor primavera , afectar , creatividad , altruismo idealismo mediador siempre volver recompensar mismo aquel amar , tal vez utilidad sino visión mundo inspirar compasión , bondad belleza querer ir . idealista : amigo ser querido mediador llegar admirar depender optimismo . creencia inquebrantable todo personar inherentemente bueno , tal vez simplemente malentender , presto actitud increíblemente resistente frente dificultad ."
ENFJ,"“ todo hacer proyectar exterior afecto todo . postura iluminar corazón transmitir ansiedad . alentar irradiar amor ensombrecer habitación depresión . mirar despertar alegría . palabra poder inspirar libertar . cada acto abrir corazón mente . ” protagonista líder nato , lleno pasión carisma . representar do ciento población , soler ser político , entrenador maestro , superar inspirar superarse hacer bien mundo . confianza natural generar influenciar , personar sentir gran orgullo alegría guiar trabajar junto fin mejorarse mismo comunidad ."
ESTJ,"dificultar expresar emocionar : evidenciar mayor debilidad ejecutivo : expresar emocionar sentir empatía . personar ejecutivo quedar tan atrapar hecho método efectivo olvidar pensar hacer feliz demás , sensibilidad . desviar ser impresionantemente hermoso , alegría familia , poder ver consecuencia llegar destinar hora tardar , lastimar ser querido rechazar noción demasiar forzar ."
ISFP,"autoestima fluctuante : exigir cuantificar habilidad , difícil hacer fortaleza sensibilidad arte aventurero . esfuerzo menudo desestimar , golpe hiriente dañino , especialmente temprano vida . poder comenzar creer detractor fuerte apoyar ."
ESTJ,"disfrutar crear orden : caos hacer coser impredecible , confiar coser impredecible necesitar . contar , esforzar crear orden seguridad entorno mediante establecimiento reglar , estructurar rolar claro ."
INTJ,"desorientar romance : resentimiento hacia reglar tendencia sobreanalizar juzgar , incluso arrogancia , sumo menudo desorientar citar . tener nuevo relación duro suficiente entender suceder cómo comportarse difícil . esforzarse formar acostumbrar empeorar coser y , desafortunadamente , común simplemente abandonar búsqueda amor . irónicamente , relajar mejor momento , entonces probable atraer especial esforzar ."
ISFJ,"reprimir sentimiento : personar privar sensible , internalizando sentimiento . mismo manera proteger sentimiento demás , deber proteger suyo , falto expresión emocional saludable generar estrés frustración ."
ISTP,"creativo práctico : imaginativo tratar coser práctico , mecánico artesanal . ideo nuevo surgir fácilmente encantar usar mano ponerlas acción ."
INTJ,"alto confianza mismo : confiar racionalismo encimar demás , decidir algo , motivo dudar decisión ideo . creer estilar comunicación honestar directo ver frenar esperar ellos . razón , razón , cambiar hacer . personar , procesar mismo cuyo cursar necesitar ser corregir , mantener posición manera ."
ENTP,"insensible : ser tan racional , debaters menudo juzgar mal sentimiento demás empujar debatir allá nivelar tolerancia demás . personar tampoco considerar punto emocional válido talar debatir , magnificar enormemente temer ."
INFP,"difícil conocer : mediador privar , reservar tímido . hacer notoriamente difícil conocer realmente , necesidad cualidad contribuir culpar menudo sentir dar mismo ser querido ."
ESTJ,mejor aun aquel reconocer equivocar
INFP,"demasiar altruista : mediador vez considerar egoísta , querer dar poder . convertir profecía autocumplida , intentar obligarse comprometerse causar elegir , olvidar atender necesidad demás vida , especialmente mismo ."
ESTJ,"voluntario : voluntad fuerte hacer posible dedicación , renunciar creencia deber simple oposición . defender ideo principio implacablemente , deber demostrar equivocar manera claro concluyente postura ceder ."
